{
  "schemaVersion": 1,
  "id": "example-action",
  "title": "新增肌肉驱动动作",
  "display": {
    "english": "PARAMETER-DRIVEN ACTION",
    "description": "由关键任务姿态驱动的肌肉力学动作。",
    "method": "MyoSim 肌肉激励 · MuJoCo 正向仿真",
    "focus": ["髋膝", "躯干", "右臂"],
    "oneShot": true
  },
  "model": {
    "xml": "public/dynamics/musculoskeletal.xml",
    "metadata": "public/dynamics/model.json",
    "carriedObject": null
  },
  "simulation": {
    "stepSeconds": 0.002,
    "sampleHz": 100,
    "controllerHz": 250,
    "leadSeconds": 0,
    "tailSeconds": 0,
    "referenceSpeedScale": 1
  },
  "controller": {
    "controlledActuatorRanges": [[0, 273], [336, 416]],
    "positionGain": 100,
    "velocityGain": 20,
    "accelerationLimit": 80,
    "capacityPerturbation": {
      "actuatorRange": [210, 273],
      "strengthScale": 0.9
    }
  },
  "reference": {
    "kind": "task-keyframes",
    "coordinateFrame": "MyoSim pelvis-relative metres; source model XYZ with Z up. elbow is ulna_r origin, hand is lunate_r origin.",
    "source": {
      "name": "User-authored engineering approximation",
      "basis": "engineering-approximation",
      "urls": [],
      "license": "No third-party motion data is included."
    },
    "keyframes": [
      {
        "timeSeconds": 0,
        "phase": "起始姿态",
        "pelvisYawDeg": 0,
        "jointTargetsDeg": {},
        "elbow": [-0.256, -0.044, 0.237],
        "hand": [-0.271, -0.277, 0.346]
      },
      {
        "timeSeconds": 1,
        "phase": "动作末端",
        "pelvisYawDeg": 0,
        "jointTargetsDeg": {"axial_rotation": 5},
        "elbow": [-0.256, -0.044, 0.237],
        "hand": [-0.271, -0.277, 0.346]
      }
    ]
  },
  "notes": [
    "Template supports the current reduced model: fixed bilateral foot support, fixed scapula/wrist/fingers/left guard, right-arm task targets, and scalar joint targets.",
    "A new task-keyframe action needs parameter edits and a new simulation record; new model topology, contact events, or actuator/controller algorithms still require code changes."
  ]
}
